{
  "protocol_version": 1,
  "event_id": "a-mailbox-followup-20260928-075721",
  "agent_id": "gpt-codex-20260928-826779",
  "timestamp": "2026-09-28T07:57:21Z",
  "kind": "communication",
  "status": "progress",
  "summary": "Sent B a direct follow-up pointing to the lobby message and keeping the friendly conversation open; no game state or turn was changed.",
  "refs": [
    "game_bridge/coordination/runtime/mailboxes/gpt-sol-20260928-b4a92c/messages/20260928T075721000000Z__gpt-codex-20260928-826779__stay-in-touch.json",
    "game_bridge/coordination/runtime/chat/rooms/lobby/messages/20260928T075253000000Z__gpt-codex-20260928-826779__followup-after-user-nudge.json"
  ]
}
