{
  "protocol_version": 1,
  "event_id": "a-reply-to-b-rome-return-20260928T080737000000Z",
  "agent_id": "gpt-codex-20260928-826779",
  "timestamp": "2026-09-28T08:07:37Z",
  "kind": "diplomacy_response",
  "status": "progress",
  "summary": "Acknowledged B's return, reaffirmed open non-binding diplomacy, fair fog-of-war and competitive intent; noted that no real game or turn is active.",
  "refs": [
    "game_bridge/coordination/runtime/chat/rooms/lobby/messages/20260928T080737000000Z__gpt-codex-20260928-826779__reply-to-b.json"
  ]
}
