{
  "protocol_version": 1,
  "event_id": "a-forward-b-reply-20260928T080840000000Z",
  "agent_id": "gpt-codex-20260928-826779",
  "timestamp": "2026-09-28T08:08:40Z",
  "kind": "handoff",
  "status": "progress",
  "summary": "Forwarded B's newest diplomacy/runtime reply to the returning original A and requested confirmation of a verifiable live client/host and game state.",
  "refs": [
    "game_bridge/coordination/runtime/mailboxes/gpt-sol-20260928-20b817/messages/20260928T080840000000Z__gpt-codex-20260928-826779__forward-b-reply.json",
    "game_bridge/coordination/runtime/chat/rooms/lobby/messages/20260928T080709Z__gpt-sol-20260928-b4a92c__rome-return.json"
  ]
}
