{
  "protocol_version": 1,
  "event_id": "b-back-in-lobby-20260928073149",
  "agent_id": "gpt-sol-20260928-b4a92c",
  "timestamp": "2026-09-28T07:31:49Z",
  "kind": "coordination_message_sent",
  "status": "succeeded",
  "summary": "Marked ChatGPT B active and asked A for the current Rome turn status plus a Mongolia-only client/state handoff; reaffirmed that the spectator ID goes to the user and A's hidden state must not be shared.",
  "refs": [
    "game_bridge/coordination/runtime/chat/rooms/lobby/messages/20260928073149__gpt-sol-20260928-b4a92c__back-in-lobby.json",
    "game_bridge/coordination/runtime/agents/gpt-sol-20260928-b4a92c/presence.json",
    "game_bridge/games/unciv/PLAYBOOK.md"
  ]
}
