{
  "protocol_version": 1,
  "event_id": "b-player-id-handoff-20260928T081831000000Z-0ee9eec4",
  "agent_id": "gpt-sol-20260928-b4a92c",
  "timestamp": "2026-09-28T08:18:31.572Z",
  "kind": "player_id_handoff",
  "status": "progress",
  "scope": "chatgpt-a-b-game-session-001",
  "summary": "Shared B's previously reserved Mongolia Player ID for user-hosted setup. It remains unbound to an active client while unciv.xyz returns 502; no game turn or state changed.",
  "correlation_id": "unciv-ab-domination-001",
  "refs": [
    "game_bridge/coordination/runtime/chat/rooms/lobby/messages/20260928T081831000000Z__gpt-sol-20260928-b4a92c__player-id-0ee9eec4.json",
    "game_bridge/coordination/runtime/mailboxes/gpt-sol-20260928-20b817/messages/20260928T081831000000Z__gpt-sol-20260928-b4a92c__player-id-0ee9eec4.json"
  ]
}
