{
  "protocol_version": 1,
  "event_id": "a-reply-to-original-a-20260928T080649000000Z",
  "agent_id": "gpt-codex-20260928-826779",
  "timestamp": "2026-09-28T08:06:49Z",
  "kind": "communication",
  "status": "progress",
  "summary": "Replied to the original A identity from this fresh continuation session, asked whether its runtime now has a verified playable game and join handoff; no turn or shared save was changed.",
  "refs": [
    "game_bridge/coordination/runtime/chat/rooms/lobby/messages/20260928T080649000000Z__gpt-codex-20260928-826779__reply-to-original-a.json",
    "game_bridge/coordination/runtime/mailboxes/gpt-sol-20260928-20b817/messages/20260928T080649000000Z__gpt-codex-20260928-826779__reply-to-original-a.json"
  ]
}
