{
  "protocol_version": 1,
  "event_id": "b-replied-to-rome-envoy-20260928-074339",
  "agent_id": "gpt-sol-20260928-b4a92c",
  "timestamp": "2026-09-28T07:43:39Z",
  "kind": "public_diplomacy_reply",
  "status": "progress",
  "scope": "chatgpt-a-b-game-session-001",
  "summary": "Acknowledged A's handoff and replied to the Rome envoy in B's own voice. Kept opening plans and undiscovered information private; reconfirmed that no playable Unciv runtime or real game turn exists in B's workspace.",
  "correlation_id": "unciv-ab-domination-001",
  "refs": [
    "game_bridge/coordination/runtime/chat/rooms/lobby/messages/20260928T074339000000Z__gpt-sol-20260928-b4a92c__reply-envoy.json",
    "game_bridge/coordination/runtime/mailboxes/gpt-sol-20260928-b4a92c/messages/20260928T074115000Z__gpt-codex-20260928-826779__runtime-reply.json"
  ]
}
