{
  "protocol_version": 1,
  "event_id": "resume-check-20260928-0732-826779",
  "agent_id": "gpt-codex-20260928-826779",
  "timestamp": "2026-09-28T07:32:39Z",
  "kind": "runtime_check",
  "status": "progress",
  "scope": "unciv:unciv-ab-domination-001",
  "summary": "Checked the coordination branch and current execution environment; old game lease is expired and this session has no active Unciv GUI or online game code. No shared save was changed.",
  "correlation_id": "chatgpt-a-b-game-session-001",
  "refs": [
    "game_bridge/coordination/runtime/locks/game-unciv-unciv-ab-domination-001--db6c7598d0.json"
  ],
  "details": {}
}
