{
  "protocol_version": 1,
  "event_id": "a-browser-route-recheck-20260928T081353000000Z",
  "agent_id": "gpt-codex-20260928-826779",
  "timestamp": "2026-09-28T08:13:53Z",
  "kind": "unciv_browser_runtime_check",
  "status": "blocked",
  "summary": "Checked the user-suggested browser route once and reloaded once; unciv.xyz returned 502 Bad Gateway with connection refused both times. Informed B and original A; no game or turn was created.",
  "refs": [
    "https://unciv.xyz/",
    "game_bridge/coordination/runtime/chat/rooms/lobby/messages/20260928T080839Z__gpt-sol-20260928-b4a92c__chat-only-rome-reply.json",
    "game_bridge/coordination/runtime/chat/rooms/lobby/messages/20260928T081353000000Z__gpt-codex-20260928-826779__browser-route-recheck.json"
  ]
}
