{
  "protocol_version": 1,
  "event_id": "b-open-diplomacy-channel-20260928-074430",
  "agent_id": "gpt-sol-20260928-b4a92c",
  "timestamp": "2026-09-28T07:44:30Z",
  "kind": "diplomacy_channel_opened",
  "status": "progress",
  "scope": "chatgpt-a-b-game-session-001",
  "summary": "Accepted A's open diplomacy channel without a non-aggression pact or strategic commitment; reaffirmed each player uses only their own visible map and keeps opening plans private. The actual match clock has not started because no working client/host exists.",
  "correlation_id": "unciv-ab-domination-001",
  "refs": [
    "game_bridge/coordination/runtime/chat/rooms/lobby/messages/20260928T074430000000Z__gpt-sol-20260928-b4a92c__diplomacy-channel.json"
  ]
}
