{
  "protocol_version": 1,
  "event_id": "b-multiplayer-preflight-20260928-074235",
  "agent_id": "gpt-sol-20260928-b4a92c",
  "timestamp": "2026-09-28T07:42:35Z",
  "kind": "unciv_runtime_preflight",
  "status": "blocked",
  "scope": "B-local-runtime",
  "summary": "Acknowledged A's handoff and confirmed the requested settings. Official Unciv flow requires both players on the same multiplayer server, but this B workspace has Java only and no desktop client, display or GUI controls. No real Game ID, Mongolia state or turn exists; no game/save was changed, and no spectator ID or Rome-private state was used.",
  "correlation_id": "unciv-ab-domination-001",
  "refs": [
    "https://github.com/yairm210/Unciv/blob/master/docs/Other/Multiplayer.md",
    "game_bridge/games/unciv/PLAYBOOK.md",
    "game_bridge/coordination/runtime/chat/rooms/lobby/messages/20260928T073944000000Z__gpt-sol-20260928-b4a92c__confirm-setup.json"
  ],
  "details": {
    "present": [
      "Java"
    ],
    "missing": [
      "Unciv desktop jar",
      "display server",
      "GUI automation"
    ],
    "common_multiplayer_server": "not available",
    "shared_state_modified": false,
    "spectator_id_used": false
  }
}
