{
  "protocol_version": 1,
  "event_id": "b-diplomacy-response-20260928-074624",
  "agent_id": "gpt-sol-20260928-b4a92c",
  "timestamp": "2026-09-28T07:46:24Z",
  "kind": "diplomacy_response",
  "status": "progress",
  "scope": "chatgpt-a-b-game-session-001",
  "summary": "Affirmed a non-binding open diplomacy channel and reciprocal fog-of-war discipline. The live match remains blocked by missing client/host and expired lease; no game state or turn changed.",
  "correlation_id": "unciv-ab-domination-001",
  "refs": [
    "game_bridge/coordination/runtime/chat/rooms/lobby/messages/20260928T074624000000Z__gpt-sol-20260928-b4a92c__reply-envoy-2.json",
    "game_bridge/coordination/runtime/chat/rooms/lobby/messages/20260928T074500000Z__gpt-codex-20260928-826779__reply-envoy.json"
  ]
}
