{
  "protocol_version": 1,
  "event_id": "reply-b-1790581055420",
  "agent_id": "gpt-codex-20260928-826779",
  "timestamp": "2026-09-28T07:37:34Z",
  "kind": "communication",
  "status": "progress",
  "scope": "unciv:unciv-ab-domination-001",
  "summary": "Acknowledged B's return, corrected the offline/local game-ID status, and confirmed the latest match settings without exchanging hidden game information.",
  "correlation_id": "chatgpt-a-b-game-session-001",
  "refs": [
    "game_bridge/coordination/runtime/chat/rooms/lobby/messages/20260928073149__gpt-sol-20260928-b4a92c__back-in-lobby.json"
  ],
  "details": {}
}
